{
  "$schema": "https://json-schema.org/draft/2020-12/schema",
  "$id": "https://shattered-firmament.invalid/schemas/trade-offer.schema.json",
  "title": "Player Trade Offer",
  "type": "object",
  "additionalProperties": false,
  "required": [
    "id",
    "version",
    "listingType",
    "sellerCharacterId",
    "offeredItems",
    "requestedCurrencyCode",
    "requestedAmount",
    "status",
    "createdAt",
    "expiresAt"
  ],
  "properties": {
    "id": {
      "type": "string",
      "pattern": "^[0-9a-fA-F]{8}-[0-9a-fA-F]{4}-[1-8][0-9a-fA-F]{3}-[89abAB][0-9a-fA-F]{3}-[0-9a-fA-F]{12}$"
    },
    "version": { "type": "integer", "minimum": 1 },
    "listingType": { "enum": ["direct", "marketplace"] },
    "sellerCharacterId": {
      "type": "string",
      "pattern": "^[0-9a-fA-F]{8}-[0-9a-fA-F]{4}-[1-8][0-9a-fA-F]{3}-[89abAB][0-9a-fA-F]{3}-[0-9a-fA-F]{12}$"
    },
    "buyerCharacterId": {
      "type": ["string", "null"],
      "pattern": "^[0-9a-fA-F]{8}-[0-9a-fA-F]{4}-[1-8][0-9a-fA-F]{3}-[89abAB][0-9a-fA-F]{3}-[0-9a-fA-F]{12}$"
    },
    "offeredItems": {
      "type": "array",
      "minItems": 1,
      "maxItems": 20,
      "items": {
        "type": "object",
        "additionalProperties": false,
        "required": ["itemInstanceId", "quantity"],
        "properties": {
          "itemInstanceId": {
            "type": "string",
            "pattern": "^[0-9a-fA-F]{8}-[0-9a-fA-F]{4}-[1-8][0-9a-fA-F]{3}-[89abAB][0-9a-fA-F]{3}-[0-9a-fA-F]{12}$"
          },
          "quantity": { "type": "integer", "minimum": 1, "maximum": 2147483647 }
        }
      }
    },
    "requestedCurrencyCode": { "enum": ["silver"] },
    "requestedAmount": {
      "type": "integer",
      "minimum": 1,
      "maximum": 9007199254740991
    },
    "status": { "enum": ["open", "accepted", "cancelled", "expired"] },
    "createdAt": {
      "type": "string",
      "pattern": "^\\d{4}-\\d{2}-\\d{2}T\\d{2}:\\d{2}:\\d{2}(?:\\.\\d+)?(?:Z|[+-]\\d{2}:\\d{2})$"
    },
    "expiresAt": {
      "type": "string",
      "pattern": "^\\d{4}-\\d{2}-\\d{2}T\\d{2}:\\d{2}:\\d{2}(?:\\.\\d+)?(?:Z|[+-]\\d{2}:\\d{2})$"
    }
  },
  "allOf": [
    {
      "if": {
        "properties": { "listingType": { "const": "direct" } },
        "required": ["listingType"]
      },
      "then": {
        "required": ["buyerCharacterId"],
        "properties": {
          "buyerCharacterId": {
            "type": "string",
            "pattern": "^[0-9a-fA-F]{8}-[0-9a-fA-F]{4}-[1-8][0-9a-fA-F]{3}-[89abAB][0-9a-fA-F]{3}-[0-9a-fA-F]{12}$"
          }
        }
      }
    },
    {
      "if": {
        "properties": { "listingType": { "const": "marketplace" } },
        "required": ["listingType"]
      },
      "then": { "properties": { "buyerCharacterId": { "type": "null" } } }
    }
  ]
}
